"Post ID","Account ID","Account username","Account name",Description,"Duration (sec)","Publish time",Permalink,"Post type","Data comment",Date,Views,Likes,Shares,Comments,Saves,Reach,Follows
18505655986051726,17841402627774708,atu_business,"ATU LeMoyne Smith School of Business","Remember when a handmade card was the ultimate Mother’s Day gift? 🥹

Some of our students brought that tradition back this week because no matter how grown up we get, we never outgrow needing our moms.

To every mom, stepmom, grandma, aunt, and mother figure, we’re grateful for all the love you give. And with graduation just behind us, this one feels extra special. We know who helped get our grads here.

Tag your mom (or your biggest supporter) and tell her how much she means to you.

Happy Mother’s Day from all of us at the College of Business and Economic Development 💗

#mothersday #callyourmom #collegelife #heckyeahtechyeah #arkansastech #handmade #thisisatu",0,"05/11/2025 10:00",https://www.instagram.com/p/DJhVkWeRMJE/,"IG carousel",,Lifetime,11853,291,10,2,0,4349,0
18024210443650805,17841400588879469,_livjohnson34,"liv 🍓","liv johnson, mba 🎓

stay tuned for marketing instructor liv ✨

#goodasgold #gradstudent #mba #graduation #gradschool #arkansastech #heckyeahtechyeah",0,"05/10/2025 11:15",https://www.instagram.com/p/DJe5Sr9ge4X/,"IG carousel",,Lifetime,2477,125,0,3,0,,
18368313112120531,17841402627774708,atu_business,"ATU LeMoyne Smith School of Business","Cap. Gown. Signature. Legacy. 🎓
And just like that, they became ATU alumni.

#Graduation #GraduationDay #ATUBusiness #CollegeLife #ArkansasTech #HeckYeahTechYeah #NightChanges",57,"05/09/2025 22:51",https://www.instagram.com/reel/DJdjjOItC81/,"IG reel",,Lifetime,14005,531,44,3,14,7877,4
17900795550179347,17841400496704543,josiahhcarterr,LOVE,"Junior is officially over already! Come watch me close it out officially! Ft. LeBron James highlights

#goodasgold #heckyeatechyea #lebron #basketball #accounting #atubusiness",62,"05/07/2025 11:25",https://www.instagram.com/reel/DJXLy5rxVX_/,"IG reel",,Lifetime,5493,150,7,6,0,,
17908505163111196,17841402627774708,atu_business,"ATU LeMoyne Smith School of Business","🏆 Awards Season 🏆

From the classroom, to the course, to the community, our students have been showing up and showing out! 

Swipe through to see a sample of academic excellence, athletic wins, and standout service and involvement. 

BRB adding “award-winning” to everyone’s resumes 🌟

#atubusiness #collegelife #heckyeahtechyeah #studentsuccess #techwins #atuexcellence #thisisatu",0,"05/06/2025 09:16",https://www.instagram.com/p/DJUYisqRO51/,"IG carousel",,Lifetime,5214,96,10,3,0,1700,0
17921613546072911,17841403918223670,ashley_.m,"Ashley Muller ☻","studying for my last spring semester of finals is making me a busy woman!! 📚✏️📓 can’t believe I only have one semester left after tomorrow! #goodasgold #finals #accounting #arkansastech",0,"05/05/2025 10:10",https://www.instagram.com/p/DJR57l4ucS3/,"IG carousel",,Lifetime,4814,209,4,7,0,,
17908490544110334,17841402627774708,atu_business,"ATU LeMoyne Smith School of Business","Time to lock in 😤 

You didn’t come this far just to come this far. Finish strong! You’ve got this! 

#finals #finalsweek #collegelife #ATUBusiness #HeckYeahTechYeah #exam #awkward #arkansastech",23,"05/04/2025 16:00",https://www.instagram.com/reel/DJP9KkcR6vP/,"IG reel",,Lifetime,10251,242,44,6,3,5574,2
18078714289746415,17841404299442673,savannah.g.rodriguez,"Savannah Rodriguez","Reading day well spent! Good luck on finals! 💚💛 

#heckyeahtechyeah #finalsweek #deadday",0,"05/02/2025 15:08",https://www.instagram.com/p/DJKtqY_JMle/,"IG carousel",,Lifetime,7509,190,3,0,0,,
17855472561378983,17841401497413900,karson.hutchins,"Karson Hutchins","Apply to be a Good as Gold Ambassador TODAY!! Applications close May 9! 🌟

Who is eligible? Students in business, agriculture, or tourism! 

Perks include a scholarship, early registration, connections, AND MORE! 

Apply using the link in @atu_business bio! 💚💛

#goodasgold #go2atu #atubusiness",6,"05/01/2025 16:00",https://www.instagram.com/reel/DJIOxEGv9ul/,"IG reel",,Lifetime,2439,46,3,0,0,,
